"ID";"Gestartet am";"Zuletzt aktualisiert am";"Status";"Collector";"Sprache";"IP-Adresse";"Gerät";"Ich erkläre mich freiwillig dazu bereit, an der oben genannten Studie teilzunehmen. Die Ziele der Studie, Datenschutzbestimmungen und meine Rechte wurden ausführlich erläutert und sind mir verständlich.";" In welchem Kurs sind Sie eingeschrieben?";"Mit welchem Geschlecht identifizieren Sie sich?";"Ich habe an dem Eye-Tracking-Versuch teilgenommen oder werde dieses noch tun.";"Wie werden komplexe Themen im LMS aufbereitet und wie beeinflusst das Ihre Lernprozesse?";"Welche Rolle spielen multimediale Inhalte im LMS für Ihr Verständnis?";"Wie bewerten Sie die Klarheit und Struktur der im LMS präsentierten Informationen?";"Auf welche Weise fördert das LMS aktive Diskussionen und Austausch mit anderen?";"Wie unterstützt das LMS Gruppenarbeit und Kollaboration unter den Lernenden?";"Welchen Einfluss hat die Benutzeroberfläche des LMS auf Ihre Interaktionsmöglichkeiten?";"Wie zeitnah und hilfreich ist das Feedback, das Sie im LMS erhalten?""";"Inwiefern unterstützen die Bewertungssysteme im LMS Ihr Verständnis über Ihren Lernfortschritt?";"Welche Rolle spielen Selbstbewertungstools im LMS für Ihre Selbsteinschätzung?";"Wie passt sich das LMS an Ihre individuellen Lernbedürfnisse an?""";"Gibt es Möglichkeiten im LMS, Lerninhalte nach Ihren Interessen und Stärken zu personalisieren?""";"(fehlende) Möglichkeiten im LMS, Lerninhalte nach Ihren Interessen und Stärken zu personalisieren.";"Wie bewerten Sie die Flexibilität des LMS in Bezug auf individuelle Lernbedürfnisse?""
";"Wie einfach ist es, auf verschiedene Ressourcen im LMS zuzugreifen?";"Wie nahtlos integriert das LMS externe Lernmaterialien oder -werkzeuge?";"Wie bewerten Sie die Barrierefreiheit und Zugänglichkeit des LMS für alle Lernenden.";"Welche Anmerkungen oder Feedback haben Sie?"
"88071023";"07.02.2024 15:17:24";"07.02.2024 15:35:28";"Angefangen, aber noch nicht abgeschlossen";"PRE-TEST | LMS-Wirkgefüge: Eye-Tracking-Studie in der Notfallsanitäterausbildung";"-";"-";"Desktop";"Ja";"21-NFS-09";"männlich";"Ja";"2";"5";"5";"2";"4";"3";"2";"4";"4";"2";"Ja";"";"4";"5";"5";"5";""
"88070022";"07.02.2024 15:05:27";"15.02.2024 08:59:43";"Angefangen, aber noch nicht abgeschlossen";"PRE-TEST | LMS-Wirkgefüge: Eye-Tracking-Studie in der Notfallsanitäterausbildung";"-";"-";"Desktop";"Ja";"22-NFS-09";"weiblich";"Nein";"3";"5";"2";"3";"2";"2";"1";"1";"2";"1";"Nein";"mehr individuelles Feedback seitens des Systems
Video Lerninhalte";"2";"3";"3";"3";""
"87965151";"06.02.2024 12:54:24";"06.02.2024 12:56:05";"Angefangen, aber noch nicht abgeschlossen";"PRE-TEST | LMS-Wirkgefüge: Eye-Tracking-Studie in der Notfallsanitäterausbildung";"-";"-";"Tablet";"Ja";"22-NFS-09";"männlich";"Nein";"";"";"";"";"";"";"";"";"";"";"";"";"";"";"";"";""
"87950671";"06.02.2024 07:56:17";"06.02.2024 15:00:01";"Abgeschlossen";"PRE-TEST | LMS-Wirkgefüge: Eye-Tracking-Studie in der Notfallsanitäterausbildung";"-";"-";"Desktop";"Ja";"23-NFS-09";"männlich";"Ja";"3";"4";"2";"4";"4";"2";"2";"3";"4";"3";"Nein";"Dadurch, dass ich die Ergebnisse oft präsentiert bekomme, kann ich keinen Einfluss darauf nehmen, wie detailiert oder auf welche Art wir das Thema lernen.";"3";"4";"4";"3";"Ich habe die Umfrage zwar ausgefüllt, allerdings bin ich noch nicht sehr lange im LMS, werde mir dieses also noch genauer anschauen bevor ich weiter darüber urteile."
"87942159";"05.02.2024 22:59:47";"05.02.2024 23:03:28";"Abgeschlossen";"PRE-TEST | LMS-Wirkgefüge: Eye-Tracking-Studie in der Notfallsanitäterausbildung";"-";"-";"Desktop";"Ja";"23-NFS-09";"männlich";"Ja";"4";"3";"2";"5";"5";"5";"4";"4";"5";"3";"Ja";"";"5";"3";"5";"4";""
"87932537";"05.02.2024 18:12:32";"05.02.2024 18:44:37";"Abgeschlossen";"PRE-TEST | LMS-Wirkgefüge: Eye-Tracking-Studie in der Notfallsanitäterausbildung";"-";"-";"Desktop";"Ja";"23-NFS-09";"männlich";"Ja";"4";"3";"5";"4";"4";"4";"5";"4";"3";"4";"Ja";"Zum Beispiel in einer Datenbank, welche uns als Kurs die eigene Gestaltung unserer erarbeiteten Ergebnisse ermöglicht. Diese Art der Wissenssicherung ist geprägt durch die verschiedenen Akzente, die die einzelnen Teilnehmer:innen bei ihrer Recherche setzen. Weiterhin lassen sich persönliche Erfahrungen oder Schwerpunkte in verwiesenen Plattformen personalisiert hinterlegen und aufbereiten. So entsteht ein direkter Bezug zwischen Theorie und Praxis.";"5";"4";"4";"3";"- Umfrage formell:
Auf der Seite ""Fragen zur Personalisierung und Anpassung"" hat sich im Titel bei Fragen ein Tippfehler eingeschlichen, siehe ""Frangen"".

- Umfrage inhaltlich:
Das Learning Management System sollte insgesamt etwas umrissen werden, um auch weniger affinen Technikanwender:innen zu verdeutlichen welche Plattformen und Systeme zum LMS gehören. Das würde auch z.B. bei der Frage zum multimedialen Einsatz das Verständnis des Anwenders unterstützen.

- LMS / Moodle:
Im Bezug auf die zur Verfügung gestellte Moodle-Plattform ""Platon"" ist auffallend, dass die Seitenleiste links selten den orientierenden Halt gibt, den sie in ihrer Position ausüben könnte. Hier ist auch ein Anwenderfehler nicht ausgeschlossen. Jedoch ist der Schnellzugriff auf häufig genutzte Inhalte in der Regel über das Einstudieren bestimmter Link-Wege oder das Ablegen von Links als Lesezeichen der durch diesen Anwender genutzte Weg. 
Ein Beispiel zur Veranschaulichung befindet sich der Anwender in der Aufgabenstellung einer Handlungssituation (H) und möchte nun in die nächste Handlungssituation gelangen, so wird er dabei nicht in der Seitenleiste fündig. Die dort verlinkten H sind noch im Bezug auf einen anderen Kurs. So geht der Anwender in der Regel den Weg über …
a) das ""Home""-Symbol um dort mithilfe der Suchleiste die gesuchte Handlungssituation zu finden.
b) auf ein sein eigenes gesetztes Lesezeichen im Browser um dorthin zu gelangen.
c) über eine Linkablage auf einer alternativen Plattform zur Wissenssicherung.
Den Anwenderfehler hier ebenfalls nicht ausgeschlossen ist die Seitenleiste eventuell individuell anpassbar.
Darüber hinaus ergab sich im bisherigen Verlauf des Kurses, dass über einige Wege und Funktionen der Plattform zu wenig oder gar nicht aufgeklärt wurde. Aus diesem erkannten Defizit ergaben sich weitere Anwenderprobleme, die mittels Austausch oder direkte Nachfrage bei Systembeauftragten geklärt werden konnten."
"87931958";"05.02.2024 17:57:16";"05.02.2024 17:59:42";"Abgeschlossen";"PRE-TEST | LMS-Wirkgefüge: Eye-Tracking-Studie in der Notfallsanitäterausbildung";"-";"-";"Mobile";"Ja";"23-NFS-09";"ohne Angabe";"Nein";"3";"4";"1";"4";"3";"1";"4";"3";"5";"1";"Ja";"Weil das so!";"3";"4";"5";"1";"Nö"
"87928675";"05.02.2024 16:39:53";"05.02.2024 17:44:21";"Angefangen, aber noch nicht abgeschlossen";"PRE-TEST | LMS-Wirkgefüge: Eye-Tracking-Studie in der Notfallsanitäterausbildung";"-";"-";"Tablet";"Ja";"22-NFS-09";"weiblich";"Ja";"4";"5";"3";"3";"5";"2";"4";"4";"4";"2";"Nein";"Unter der Voraussetzung, dass sich das LMS nur auf die Moodle-Plattform bezieht, gibt es keine Möglichkeit den gesamten Inhalt der Handlungssituationen auf einen Schlag zu sehen und personalisieren zu können.
Die Unterteilung der Ausbildungsinhalte erfolgt in überschaubaren Handlungssituationen (in 32 „Häppchen“), mir stellt sich hier die Frage, ob ich den Ausbildungsinhalt überhaupt personalisieren sollte.
In der gesamten Schule passen sich die einzelnen Kurse (z.B NotSan-Kurse, RS und RH) an die Anforderungen der Klassen an.";"3";"5";"4";"5";"Das Wiki lässt Raum für Aufgabenstellungen, die nicht in den Handlungssituationen stehen, aber im Unterricht besprochen werden.
Ein Inhaltsverzeichnis, (Aufgabenverzeichnis) in dem ich sämtliche Aufgabenstellungen der Handlungssituationen sehen kann, fehlt mir persönlich.
Mir fehlt eine Möglichkeit einen Lernplan zu erstellen, mit der Idee, die Themen abzuhaken, die ich bearbeitet habe, ohne dabei in den Handlungssituationen wechseln zu müssen und im Zweifel nach Themen suchen muss."
"87924165";"05.02.2024 14:57:26";"05.02.2024 14:58:32";"Angefangen, aber noch nicht abgeschlossen";"PRE-TEST | LMS-Wirkgefüge: Eye-Tracking-Studie in der Notfallsanitäterausbildung";"-";"-";"Mobile";"Ja";"23-NFS-09";"weiblich";"Ja";"";"";"";"";"";"";"";"";"";"";"";"";"";"";"";"";""
"87923341";"05.02.2024 14:37:52";"06.02.2024 07:58:41";"Abgeschlossen";"PRE-TEST | LMS-Wirkgefüge: Eye-Tracking-Studie in der Notfallsanitäterausbildung";"-";"-";"Desktop";"Ja";"22-NFS-09";"männlich";"Ja";"3";"3";"5";"4";"5";"5";"3";"3";"3";"2";"Ja";"Auswahl der Themen für Bearbeitung im Bearbeitungsforum";"3";"5";"5";"3";""
