"_Antwort-ID";"Resume-Code";"Teilnehmer-IDs / TAN";"Email-Adresse";"IP-Adresse";"Start";"Datum und Zeit";"Teilnahmestatus";"1. Wie haben Sie während Ihres Coachings die räumlichen und zeitlichen Rahmenbedingungen erlebt?";"Die Coachingsitzungen fanden in angenehmer Atmosphäre statt.";"Die Häufigkeit der Termine war angemessen.";"Die Dauer der Sitzungen war angemessen.";"2. Wie haben Sie den Beginn Ihres Coachings erlebt, als Sie gemeinsam mit Ihrem Coach die Zusammenarbeit vereinbarten?";"Mein Coach einigte sich mit mir über die konkrete Vorgehensweise.";"Wir konkretisierten meine Coachingziele bzw. mein Coachingziel.";"Gemeinsam klärten wir die Grundlagen unserer Arbeitsbeziehung.";"Mein Coach stellte mir sein Konzept vor.";"Mein Coach erklärte mir, welche Methoden er verwendet.";"Mein Coach erklärte mir, mit welcher Absicht er welche Tools bzw. Techniken einsetzen würde.";"Wir legten gemeinsam Grenzen und Tabuzonen fest.";"Gemeinsam identifizierten wir Faktoren, die die Zielerreichung gefährden könnten.";"Mein Coach vereinbarte mit mir objektive Zielerreichungskriterien.";"3. Wie war die Zusammenarbeit mit Ihrem Coach?";"Wir hatten ein vertrauensvolles Verhältnis zueinander.";"Unsere Beziehung war von gegenseitiger Wertschätzung geprägt.";"Unsere Beziehung zeichnete sich durch Offenheit aus.";"Wir waren einander sympathisch.";"Wir sind uns als gleichberechtigte Partner/innen begegnet.";"Mein Coach gestaltete den Prozess unserer Zusammenarbeit sicher und professionell.";"Die von meinem Coach eingesetzten Methoden und Tools waren angemessen und passten zu meinem Thema.";"Ich konnte während des gesamten Coachings aufeinander aufbauende Prozessschritte erkennen.";"Ich gestaltete den Coachingprozess gemein- sam mit meinem Coach.";"Mein Coach holte sich regelmäßig Feedback von mir ein.";"Nach einzelnen Prozessschritten zogen wir gemeinsam Resümee und besprachen unser weiteres Vorgehen.";"Mein Coach regte mich dazu an, den Coachingprozess zu reflektieren und mitzugestalten.";"4. Bitte tragen Sie hier Ihre drei wichtigsten Anliegen ein.";"#1";"#2";"#3";"5. Bitte bewerten Sie Ihre Anliegen entsprechend der Bearbeitung. Schätzen Sie bitte zusätzlich die Wichtigkeit Ihrer Anliegen ein.";"Mein erstes Anliegen wurde...";"Gewichtung";"Mein zweites Anliegen wurde...";"Gewichtung";"Mein drittes Anliegen wurde...";"Gewichtung";"6. Durch das Coaching…";"…bin ich mir meiner Stärken und Schwächen deutlicher bewusst.";"…nutze ich meine Fähigkeiten und Fertig- keiten gezielter.";"…habe ich mein Selbstwertgefühl gesteigert.";"…habe ich neue Verhaltensweisen erlernt.";"…habe ich meine Einstellung zu bestimmten Themen verändert.";"…habe ich unerwünschte Verhaltensweisen abgebaut.";"…habe ich mehr Klarheit über meine Situation gewonnen.";"…verstehe ich andere (z.B. meine Kollegen/ innen, Mitarbeiter/ innen...) besser.";"…fühle ich mich emotional entlastet.";"…bin ich zufriedener geworden.";"7. Bitte schätzen Sie ein, inwieweit Ihr Umfeld Veränderungen durch das Coaching wahrgenommen hat.";"Kollegen/Mitarbeiter haben Veränderungen durch das Coaching bemerkt und mir rückgemeldet.";"Freunde/Familie haben Veränderungen durch das Coaching bemerkt und mir rückgemeldet.";"8. Bitte schätzen Sie anhand folgender Aussagen ein, wie Sie Ihr Coaching abschließend bewerten.";"Ich würde grundsätzlich noch einmal ein Coaching in Anspruch nehmen.";"Ich würde Coaching weiterempfehlen.";"Ich würde meinen Coach weiterempfehlen.";"9. Bitte schätzen Sie anhand folgender Aussagen ein, wie Sie Ihr Coaching abschließend bewerten.";"Mit dem Coaching-Prozess bin ich zufrieden.";"Mit dem Coaching-Ergebnis bin ich zufrieden.";"Aufwand und Nutzen standen im richtigen Verhältnis.";"Den zeitlichen Aufwand fand ich gerechtfertigt.";"Das Honorar war angemessen.";"Bei meiner Fragestellung wäre eine andere Maßnahme angemessener gewesen.";"Ich denke, dass mein Coaching von langfristigem Nutzen sein wird.";"Das Coaching hat mir geholfen, meine Ziele zu erreichen.";"Ich konnte die Erfahrungen aus meinem Coaching im Alltag umsetzen.";"10. Alles in allem, auf einer Skala von 1 bis 10: Wie war Ihr Coaching insgesamt?";"11. Was muss auf jeden Fall noch gesagt werden, was bisher noch keine Berücksichtigung fand?";"12. Ihr Alter in Jahren";"13. Ihr Geschlecht";"14. Möchten Sie Ihre Antworten als Link gesendet bekommen?";"15. Bitte geben Sie Ihre E-Mail-Adresse ein.";
"80464210";"0a1efdf";"83aa472";"d.wessels@freenet.de";"80.187.111.114";"16.02.2021 13:58";"16.02.2021 14:05";"teilgenommen und beendet";"";"4";"5";"5";"";"4";"5";"5";"4";"4";"4";"5";"4";"5";"";"4";"5";"4";"5";"4";"4";"4";"4";"5";"5";"5";"5";"";"";"";"";"";"5";"100%";"4";"67%";"0";"";"";"4";"4";"4";"4";"4";"3";"5";"0";"3";"4";"";"5";"5";"";"5";"5";"5";"";"4";"5";"4";"5";"4";"2";"4";"5";"5";"80";"";"43";"männlich";"";"";
"81743802";"ca91ef8";"0ecbf75";"jennifer.thoennes@web.de";"178.6.207.112";"22.03.2021 08:42";"18.04.2021 15:08";"teilgenommen und beendet";"";"5";"5";"4";"";"5";"5";"5";"4";"5";"5";"5";"4";"3";"";"5";"4";"5";"5";"5";"5";"5";"5";"4";"5";"5";"5";"";"Ängste";"Sicherheit";"";"";"5";"100%";"5";"100%";"";"";"";"4";"5";"5";"5";"5";"4";"5";"3";"5";"5";"";"3";"0";"";"5";"5";"5";"";"5";"4";"5";"5";"5";"1";"4";"5";"5";"90";"";"33";"weiblich";"nein";"";
"92157992";"jmqtqf4";"4nhfmpvsg";"sarah.grosshaeuser@gmail.com";"88.152.128.182";"27.06.2022 21:44";"03.07.2022 12:20";"teilgenommen und beendet";"";"5";"5";"5";"";"5";"5";"5";"5";"5";"5";"5";"4";"5";"";"5";"5";"5";"5";"5";"5";"5";"5";"5";"5";"5";"5";"";"Klarheit über zukünftige Berufswahl";"Sicherheit bzgl. Fähigkeiten &amp; 'Berufung'";"Sicherheit im Umgang mit Entscheidungen";"";"5";"67%";"5";"67%";"5";"67%";"";"4";"3";"4";"4";"5";"4";"4";"0";"4";"4";"";"0";"5";"";"5";"5";"5";"";"5";"4";"5";"5";"5";"1";"5";"4";"4";"90";"Viele Dinge haben wir schon persönlich besprochen., Das Coaching kam zum richtigen Zeitpunkt und hat sich so perfekt mit den Umständen und daraus resultierenden Veränderungen und Verbesserungen ergänzt., Ich freue mich auf alles, was daraus noch entsteht und komme jederzeit gerne auf Dich zurück.";"25";"weiblich";"nein";"";
"95668092";"hr3pt9c";"cbvjbgakw";"ivy.marshall141@gmail.com";"91.50.108.141";"06.05.2023 13:16";"06.05.2023 13:29";"teilgenommen und beendet";"";"5";"5";"5";"";"5";"5";"5";"5";"5";"5";"5";"1";"4";"";"5";"5";"5";"5";"5";"5";"5";"5";"5";"5";"5";"5";"";"Ein Konstrukt zu erlangen, auf das ich zurückgreifen kann, um mit meiner Fernbeziehung umzugehen";"Ruhe und bedingte Akzeptanz";"Mich zu öffnen, um über meine Sorgen zu reden";"";"5";"100%";"5";"100%";"5";"100%";"";"5";"5";"5";"5";"5";"5";"5";"5";"5";"5";"";"3";"3";"";"5";"5";"5";"";"5";"5";"5";"5";"5";"1";"5";"5";"5";"100";"";"19";"weiblich";"nein";"";
"97441390";"pakidfg";"hcgwqhjis";"batichka@yahoo.de";"109.42.176.103";"08.11.2023 09:36";"08.11.2023 09:48";"teilgenommen und beendet";"";"5";"5";"5";"";"5";"5";"5";"5";"5";"5";"5";"5";"5";"";"5";"5";"5";"5";"5";"5";"5";"5";"5";"5";"5";"5";"";"Angst überwinden";"Lernerfolg";"Prüfung meistern";"";"5";"100%";"5";"100%";"5";"100%";"";"5";"5";"5";"5";"5";"5";"5";"3";"5";"5";"";"5";"5";"";"5";"5";"5";"";"5";"5";"5";"5";"5";"1";"5";"5";"5";"100";"Ich bin einfach nur sehr dankbar und sehr glücklich";"51";"weiblich";"nein";"";
